{
  "$schema": "../schemas/adoption-evidence.schema.json",
  "schemaVersion": 3,
  "status": "not-demonstrated",
  "records": [],
  "minimumForDemonstrated": 2,
  "collectionPolicy": {
    "consentRequired": true,
    "rawPrivateDataAllowed": false,
    "retentionDays": 365,
    "withdrawalMechanism": "Open a private maintainer request referencing only the public-safe record ID.",
    "allowedSignals": ["installation", "activation", "successful-workflow", "maintenance-commitment"]
  },
  "claimBoundary": "The public fixtures and second-product compiler proof are internal conformance evidence, not external consumer adoption. Repository-local validation and consent documents are maintainer-attested inputs only and cannot unlock demonstrated status without an independent external provenance verifier."
}
